{
  "id": "level_1_forest",
  "name": "Level 1: Forest",
  "theme": "forest",
  "difficulty": "easy",
  "timing": {
    "preMiniBossSeconds": null,
    "preMiniBossWaves": 3,
    "preBossSeconds": null,
    "preBossWaves": 5
  },
  "waves": [
    {
      "formation": "v",
      "enemyType": "scout",
      "count": 3,
      "eliteCount": 1,
      "staggerSeconds": 0.6,
      "betweenWaveDelaySeconds": 2
    },
    {
      "formation": "v",
      "enemyType": "scout",
      "count": 4,
      "eliteCount": 1,
      "staggerSeconds": 0.6,
      "betweenWaveDelaySeconds": 2
    },
    {
      "formation": "staggered_wedge",
      "enemyType": "scout",
      "count": 3,
      "eliteCount": 1,
      "staggerSeconds": 0.5,
      "betweenWaveDelaySeconds": 2
    },
    {
      "formation": "staggered_wedge",
      "enemyType": "scout",
      "count": 4,
      "eliteCount": 1,
      "staggerSeconds": 0.5,
      "betweenWaveDelaySeconds": 2
    },
    {
      "formation": "pincer",
      "enemyType": "scout",
      "count": 5,
      "eliteCount": 1,
      "staggerSeconds": 0.6,
      "betweenWaveDelaySeconds": 2
    }
  ],
  "enemyStyle": "mixed",
  "miniboss": {
    "archetypeId": "enlarged_elite",
    "hp": 150
  },
  "boss": {
    "archetypeId": "root_seeker",
    "hp": 200
  }
}
